{"schema_version":1,"phase":"27","completed_at":"2026-09-11T19:15:00+04:00","files_changed":["python/codeflow_ml/query.py","python/codeflow_ml/test_query.py"],"commands_run":["python -m unittest python.codeflow_ml.test_query python.codeflow_ml.test_zoom python.codeflow_ml.test_baselines python.codeflow_ml.test_graph_data python.codeflow_ml.test_experiments python.codeflow_ml.test_runtime python.codeflow_ml.test_workflows -v","python scripts/no_llm_guard.py"],"tests":["15 combined tests passed, including bounded overview/expand queries, feature/dependency/impact paths, revision diffs, deterministic JSON evidence views, semantic zoom, and all prior regressions"],"test_outcomes":[{"name":"overview and expand queries","status":"passed"},{"name":"dependency, impact, and revision diff","status":"passed"},{"name":"deterministic evidence JSON","status":"passed"}],"benchmark_outcomes":[{"name":"query budget enforcement","status":"passed","details":"Overview, expansion, and path traversal enforce explicit budgets and stable ordering."}],"known_limitations":["Query primitives are backend serialization contracts; authentication and transport remain later boundary concerns."],"no_llm_compliance":true,"schema_changes":["Added bounded query and deterministic view materialization APIs."],"next_phase_dependencies":["backend API and persistence contracts"]}
