{"schema_version":1,"phase":"29","completed_at":"2026-09-11T21:15:00+04:00","files_changed":["python/codeflow_ml/resources.py","python/codeflow_ml/test_resources.py"],"commands_run":["python -m unittest python.codeflow_ml.test_resources python.codeflow_ml.test_query python.codeflow_ml.test_zoom python.codeflow_ml.test_baselines python.codeflow_ml.test_graph_data python.codeflow_ml.test_experiments python.codeflow_ml.test_runtime python.codeflow_ml.test_workflows -v","python scripts/no_llm_guard.py"],"tests":["16 combined tests passed, including benchmark tiers, positive resource budgets, bounded batches, CPU/GPU selection, cancellation progress events, query budgets, and all prior regression suites"],"test_outcomes":[{"name":"size tiers and batching","status":"passed"},{"name":"resource budget validation","status":"passed"},{"name":"device selection and cancellation","status":"passed"}],"benchmark_outcomes":[{"name":"bounded large-repository strategy","status":"passed","details":"Batching, budgets, and progress controls are explicit and deterministic."}],"known_limitations":["GPU selection is capability-based through CUDA visibility; no GPU dependency is required for offline operation."],"no_llm_compliance":true,"schema_changes":["Added ResourceBudget, batching, tier, device, and progress APIs."],"next_phase_dependencies":["final execution validation and report"]}
