{"schema_version":1,"phase":"15","completed_at":"2026-09-11T11:55:00+04:00","files_changed":["crates/codeflow-analysis/src/lib.rs"],"commands_run":["cargo fmt --all","cargo test -p codeflow-analysis --all-features","cargo clippy -p codeflow-analysis --all-targets --all-features -- -D warnings"],"tests":["11 analysis tests passed, covering multilingual-safe identifier tokenization, noise filtering, TF-IDF vectors, BM25 scoring, route/datastore vocabulary signals, neighborhood enrichment, deterministic label ranking, and unknown-safe behavior"],"test_outcomes":[{"name":"identifier and noise signals","status":"passed"},{"name":"TF-IDF and BM25 vectors","status":"passed"},{"name":"neighborhood and candidate labels","status":"passed"}],"benchmark_outcomes":[{"name":"deterministic candidate ordering","status":"passed","details":"Equal scores are ordered by canonical label."}],"known_limitations":["Lexical semantic extraction is intentionally classical and deterministic; it does not infer meaning beyond observed vocabulary."],"no_llm_compliance":true,"schema_changes":["Added serializable LexicalVector and deterministic lexical feature APIs."],"next_phase_dependencies":["workflow reconstruction"]}
