{"schema_version":1,"phase":"21","completed_at":"2026-09-11T14:45:00+04:00","files_changed":["python/codeflow_ml/runtime.py","python/codeflow_ml/test_runtime.py"],"commands_run":["python -m unittest python.codeflow_ml.test_runtime python.codeflow_ml.test_workflows python.codeflow_ml.test_baselines -v","python scripts/no_llm_guard.py"],"tests":["9 combined tests passed, including session normalization, repeated subsequence compression, dominant path frequencies, static/dynamic alignment, malformed trace handling, and prior workflow/ML regressions"],"test_outcomes":[{"name":"trace session normalization","status":"passed"},{"name":"repetition compression and frequencies","status":"passed"},{"name":"static/dynamic alignment","status":"passed"}],"benchmark_outcomes":[{"name":"synthetic trace abstraction","status":"passed","details":"Compression and aggregation operate in bounded linear passes over each session."}],"known_limitations":["Trace abstraction summarizes observed sessions and preserves rare paths through frequency keys; it does not synthesize unobserved behavior."],"no_llm_compliance":true,"schema_changes":["Added session normalization, repetition compression, frequency, and alignment APIs."],"next_phase_dependencies":["incremental persistence and public contracts"]}
