{"schema_version":1,"phase":"18","completed_at":"2026-09-11T13:00:00+04:00","files_changed":["python/codeflow_ml/baselines.py","python/codeflow_ml/test_baselines.py"],"commands_run":["python -m unittest python.codeflow_ml.test_baselines -v","python scripts/no_llm_guard.py"],"tests":["4 tests passed for centrality-based infrastructure candidates, domain-specificity, multi-feature participation, datastore/messaging/utility classification, and cross-cutting scoring"],"test_outcomes":[{"name":"infrastructure centrality","status":"passed"},{"name":"domain versus utility discrimination","status":"passed"},{"name":"shared infrastructure classification","status":"passed"}],"benchmark_outcomes":[{"name":"high-degree correction","status":"passed","details":"Centrality scores normalize against maximum degree and remain deterministic."}],"known_limitations":["Name classification is conservative and vocabulary-driven; ambiguous names remain candidate evidence rather than forced infrastructure labels."],"no_llm_compliance":true,"schema_changes":["Added infrastructure centrality, domain-specificity, participation, and shared-name classifiers."],"next_phase_dependencies":["workflow reconstruction"]}
