{"schema_version":1,"phase":"17","completed_at":"2026-09-11T12:35:00+04:00","files_changed":["python/codeflow_ml/baselines.py","python/codeflow_ml/test_baselines.py"],"commands_run":["python -m unittest python.codeflow_ml.test_baselines -v","python -m compileall -q python/codeflow_ml","python scripts/no_llm_guard.py"],"tests":["3 feature-location tests passed, covering many-to-many candidate modeling, structural/lexical/entry-point/side-effect/scenario signals, deterministic merge, and UNKNOWN suppression"],"test_outcomes":[{"name":"feature candidate model","status":"passed"},{"name":"relevance and merge","status":"passed"},{"name":"unknown-safe assignment","status":"passed"}],"benchmark_outcomes":[{"name":"candidate merge ordering","status":"passed","details":"Candidates are sorted by relevance then stable feature/entity IDs."}],"known_limitations":["Feature assignment remains evidence-weighted candidate generation; it does not claim semantic certainty for unknown inputs."],"no_llm_compliance":true,"schema_changes":["Added FeatureCandidate and deterministic feature merge/seed APIs."],"next_phase_dependencies":["workflow reconstruction and execution-path recovery"]}
