{"schema_version":1,"phase":"13","completed_at":"2026-09-11T11:20:00+04:00","files_changed":["crates/codeflow-upsm/src/lib.rs"],"commands_run":["cargo fmt --all","cargo test -p codeflow-upsm --all-features","cargo clippy -p codeflow-upsm --all-targets --all-features -- -D warnings"],"tests":["6 UPSM tests passed, including mixed-resolution projection, degree metrics, SCCs, deterministic Leiden/agglomerative/HDBSCAN baselines, and stability"],"test_outcomes":[{"name":"graph projection and degree metrics","status":"passed"},{"name":"deterministic clustering baselines","status":"passed"},{"name":"partition stability","status":"passed"}],"benchmark_outcomes":[{"name":"baseline repeatability","status":"passed","details":"Repeated deterministic partition returns identical canonical assignments."}],"known_limitations":["Leiden and agglomerative baselines use deterministic connected-component semantics pending calibrated weighted datasets; HDBSCAN is conservative density exploration."],"no_llm_compliance":true,"schema_changes":["Added projection, degree, partition, clustering baseline, and stability APIs."],"next_phase_dependencies":["classical ML feature and ranking pipeline"]}
