{
  "schema_version": 1,
  "phase": "03",
  "completed_at": "2026-09-10T17:30:00+04:00",
  "files_changed": ["Cargo.toml", "Cargo.lock", "crates/codeflow-project/Cargo.toml", "crates/codeflow-project/src/lib.rs"],
  "commands_run": ["cargo fmt --check", "cargo test --workspace --all-features", "cargo clippy --workspace --all-targets --all-features -- -D warnings", "python scripts/harness.py self-audit", "python scripts/no_llm_guard.py", "git diff --check"],
  "tests": ["codeflow-project: 2 passed", "full workspace: 7 passed"],
  "test_outcomes": [{"name": "registration metadata and deterministic snapshots", "status": "passed"}, {"name": "binary/generated/oversized classification", "status": "passed"}, {"name": "vendor and metadata exclusion", "status": "passed"}],
  "benchmark_outcomes": [],
  "known_limitations": ["Git revision detection reports absence as null for a non-Git target; no source content is persisted in diagnostics."],
  "no_llm_compliance": true,
  "schema_changes": ["Added project snapshot schema version 1."],
  "next_phase_dependencies": ["RepositorySnapshot", "SnapshotFile", "SourceIdentity"]
}
