{"schema_version":1,"phase":"09","completed_at":"2026-09-11T10:00:00+04:00","files_changed":["crates/codeflow-store/Cargo.toml","crates/codeflow-store/src/lib.rs"],"commands_run":["cargo test -p codeflow-store --all-features","cargo clippy -p codeflow-store --all-targets --all-features -- -D warnings","python -m json.tool Execution/Execution 01.state.json"],"tests":["SQLite WAL activation, graph indexes, and real Parquet encoding: 1 integration test passed"],"test_outcomes":[{"name":"atomic revision activation","status":"passed"},{"name":"forward/reverse graph indexes","status":"passed"},{"name":"Parquet payload and persistence","status":"passed"}],"benchmark_outcomes":[],"known_limitations":[],"no_llm_compliance":true,"schema_changes":["Added SQLite graph/index and Parquet feature snapshot storage."],"next_phase_dependencies":["revision invalidation closure"]}
