{"schema_version":1,"phase":"12","completed_at":"2026-09-11T11:00:00+04:00","files_changed":["crates/codeflow-upsm/src/lib.rs"],"commands_run":["cargo fmt --all","cargo test -p codeflow-upsm --all-features","cargo clippy -p codeflow-upsm --all-targets --all-features -- -D warnings"],"tests":["5 UPSM tests passed, including provider-neutral call/control/data/event/external normalization, unknown boundaries, conflict retention, and SCC paths"],"test_outcomes":[{"name":"relation normalization","status":"passed"},{"name":"unknown and external boundaries","status":"passed"},{"name":"interprocedural graph path and SCC","status":"passed"}],"benchmark_outcomes":[],"known_limitations":["Provider-specific relation aliases not enumerated beyond the deterministic raw vocabulary; unknown values remain explicit."],"no_llm_compliance":true,"schema_changes":["Added RawRelation and normalize_relation canonical semantic vocabulary."],"next_phase_dependencies":["semantic HAG construction"]}
