{"schema_version":1,"phase":"14","completed_at":"2026-09-11T11:35:00+04:00","files_changed":["crates/codeflow-hag/src/lib.rs"],"commands_run":["cargo fmt --all","cargo test -p codeflow-hag --all-features","cargo clippy -p codeflow-hag --all-targets --all-features -- -D warnings"],"tests":["4 HAG tests passed, covering taxonomy, typed relations, many-to-many membership, hierarchy cycle safety, cross-cutting/shared infrastructure, manual constraints, provenance, and schema migration"],"test_outcomes":[{"name":"HAG taxonomy and edges","status":"passed"},{"name":"many-to-many and hierarchy","status":"passed"},{"name":"constraints and future schema","status":"passed"}],"benchmark_outcomes":[],"known_limitations":["HAG concepts remain evidence-backed and separate from UPSM implementation truth; no inferred concept is authoritative over implementation evidence."],"no_llm_compliance":true,"schema_changes":["Added HAG schema migration and cycle-safe hierarchy validation."],"next_phase_dependencies":["workflow reconstruction"]}
