{"schema_version":1,"phase":"24","completed_at":"2026-09-11T17:00:00+04:00","files_changed":["python/codeflow_ml/graph_data.py","python/codeflow_ml/test_graph_data.py"],"commands_run":["python -m unittest python.codeflow_ml.test_graph_data python.codeflow_ml.test_experiments python.codeflow_ml.test_runtime python.codeflow_ml.test_workflows python.codeflow_ml.test_baselines -v","python scripts/no_llm_guard.py"],"tests":["12 tests passed, covering deterministic node2vec-style embeddings, GCN/GAT/heterogeneous encoders, typed link reconstruction, masked feature loss, neighbor sampling, graph round-trip, and prior regressions"],"test_outcomes":[{"name":"representation baselines","status":"passed"},{"name":"typed heterogeneous encoders","status":"passed"},{"name":"link/masked objectives and sampling","status":"passed"}],"benchmark_outcomes":[{"name":"DL versus deterministic baseline reproducibility","status":"passed","details":"All representation paths are deterministic and remain proposal/evidence layers, not authoritative program facts."}],"known_limitations":["Dependency-free encoders provide research-compatible deterministic contracts rather than GPU training; no LLM or external model service is introduced."],"no_llm_compliance":true,"schema_changes":["Added node2vec-style, GCN/GAT/heterogeneous encoding, link reconstruction, masking, and neighbor sampling APIs."],"next_phase_dependencies":["model comparative evaluation and graph persistence"]}
