{"schema_version":1,"phase":"31","completed_at":"2026-09-11T23:00:00+04:00","files_changed":["python/codeflow_ml/observability.py","python/codeflow_ml/test_observability.py"],"commands_run":["python -m unittest python.codeflow_ml.test_observability python.codeflow_ml.test_security python.codeflow_ml.test_resources python.codeflow_ml.test_query python.codeflow_ml.test_zoom python.codeflow_ml.test_baselines python.codeflow_ml.test_graph_data python.codeflow_ml.test_experiments python.codeflow_ml.test_runtime python.codeflow_ml.test_workflows -v","python scripts/no_llm_guard.py","python scripts/harness.py self-audit"],"tests":["18 combined tests passed, including correlation IDs, structured timing/capability diagnostics, quarantine records, diagnostic bundles, security, resource, query, and analysis regressions"],"test_outcomes":[{"name":"structured diagnostics","status":"passed"},{"name":"failed-run quarantine","status":"passed"},{"name":"fault/restart-safe records","status":"passed"}],"benchmark_outcomes":[],"known_limitations":["Diagnostic bundle contains structured metadata only; source content is intentionally excluded."],"no_llm_compliance":true,"schema_changes":["Added Diagnostic, correlation, quarantine, and bundle APIs."],"next_phase_dependencies":["final acceptance gate and report"]}
