{"schema_version":1,"phase":"16","completed_at":"2026-09-11T12:15:00+04:00","files_changed":["python/codeflow_ml/baselines.py","python/codeflow_ml/test_baselines.py"],"commands_run":["python -m unittest python.codeflow_ml.test_baselines -v","python -m compileall -q python/codeflow_ml","python scripts/no_llm_guard.py","python scripts/harness.py self-audit"],"tests":["2 dependency-free ML baseline tests passed, covering feature matrix validation, Naive Bayes, logistic regression, tree ranking, clustering ensemble, quality estimation, and adaptive weights"],"test_outcomes":[{"name":"feature matrix and classical models","status":"passed"},{"name":"reproducible inference","status":"passed"},{"name":"no-LLM guard and harness","status":"passed"}],"benchmark_outcomes":[{"name":"repeated inference determinism","status":"passed","details":"Pure-Python baselines use stable sorted classes and deterministic tie-breaking."}],"known_limitations":["Baselines are intentionally dependency-free reference implementations; production-scale acceleration remains a later optimization."],"no_llm_compliance":true,"schema_changes":["Added Python FeatureMatrix and classical baseline APIs."],"next_phase_dependencies":["deep learning comparative evaluation"]}
