{"schema_version":1,"phase":"06","completed_at":"2026-09-10T18:05:00+04:00","files_changed":["crates/codeflow-analysis/Cargo.toml","crates/codeflow-analysis/src/lib.rs"],"commands_run":["cargo test -p codeflow-analysis --all-features","cargo clippy -p codeflow-analysis --all-targets --all-features -- -D warnings"],"tests":["Joern fallback, bounded process contract, and CPG export decoding: 10 analysis tests passed"],"test_outcomes":[{"name":"Joern availability fallback","status":"passed"},{"name":"provider-local CPG import","status":"passed"}],"benchmark_outcomes":[],"known_limitations":["No Joern installation is available locally; this provider remains capability-gated."],"no_llm_compliance":true,"schema_changes":["Added provider-local CPG evidence decoder."],"next_phase_dependencies":["UPSM merge engine"]}
