{"schema_version":1,"phase":"19","completed_at":"2026-09-11T13:35:00+04:00","files_changed":["python/codeflow_ml/workflows.py","python/codeflow_ml/test_workflows.py"],"commands_run":["python -m unittest python.codeflow_ml.test_workflows python.codeflow_ml.test_baselines -v","python scripts/no_llm_guard.py"],"tests":["6 combined tests passed, including deterministic entry-point discovery, bounded interprocedural paths, SCC/recursion termination, exceptional branch ranking, side-effect binding, and feature baseline regression"],"test_outcomes":[{"name":"workflow entry points and paths","status":"passed"},{"name":"bounded cycles and path explosion","status":"passed"},{"name":"side effects and exceptional ranking","status":"passed"}],"benchmark_outcomes":[{"name":"path bound","status":"passed","details":"max_depth and max_paths are enforced for cyclic and branching graphs."}],"known_limitations":["Workflow reconstruction emits bounded possible paths, not a claim of complete runtime execution coverage."],"no_llm_compliance":true,"schema_changes":["Added bounded WorkflowStep and workflow reconstruction/ranking APIs."],"next_phase_dependencies":["semantic graph analytics and persistence"]}
