{"schema_version":1,"phase":"30","completed_at":"2026-09-11T22:15:00+04:00","files_changed":["python/codeflow_ml/security.py","python/codeflow_ml/test_security.py"],"commands_run":["python -m unittest python.codeflow_ml.test_security python.codeflow_ml.test_resources python.codeflow_ml.test_query python.codeflow_ml.test_zoom python.codeflow_ml.test_baselines python.codeflow_ml.test_graph_data python.codeflow_ml.test_experiments python.codeflow_ml.test_runtime python.codeflow_ml.test_workflows -v","python scripts/no_llm_guard.py","python scripts/harness.py self-audit"],"tests":["17 combined tests passed, including root/symlink escape defense, implicit script execution blocking, secret redaction, offline default, resource controls, graph queries, and all prior regressions"],"test_outcomes":[{"name":"path and command trust boundaries","status":"passed"},{"name":"secret-safe logging and offline default","status":"passed"},{"name":"malicious input regression suite","status":"passed"}],"benchmark_outcomes":[],"known_limitations":["OS-level sandboxing is delegated to deployment; application-level path, command, redaction, and offline guards are enforced."],"no_llm_compliance":true,"schema_changes":["Added safe path, command allowlist, secret redaction, and network-offline policy APIs."],"next_phase_dependencies":["final acceptance and report"]}
