{"schema_version":1,"phase":"08","completed_at":"2026-09-10T18:12:00+04:00","files_changed":["crates/codeflow-core/src/lib.rs"],"commands_run":["cargo test -p codeflow-core --all-features","cargo clippy -p codeflow-core --all-targets --all-features -- -D warnings"],"tests":["provenance and confidence suite: 7 passed"],"test_outcomes":[{"name":"provenance completeness","status":"passed"},{"name":"unknown confidence aggregation","status":"passed"}],"benchmark_outcomes":[],"known_limitations":[],"no_llm_compliance":true,"schema_changes":["Added EvidenceRecord and confidence aggregation."],"next_phase_dependencies":["SQLite revision store"]}
