{"schema_version":1,"phase":"07","completed_at":"2026-09-10T18:10:00+04:00","files_changed":["Cargo.toml","Cargo.lock","crates/codeflow-upsm/Cargo.toml","crates/codeflow-upsm/src/lib.rs"],"commands_run":["cargo test -p codeflow-upsm --all-features","cargo clippy -p codeflow-upsm --all-targets --all-features -- -D warnings"],"tests":["canonical merge, conflict retention, semantic normalization, and schema migration: 4 passed"],"test_outcomes":[{"name":"canonical merge","status":"passed"},{"name":"schema compatibility","status":"passed"}],"benchmark_outcomes":[],"known_limitations":[],"no_llm_compliance":true,"schema_changes":["Added UPSM schema version 1."],"next_phase_dependencies":["EvidenceRecord","Confidence"]}
