{"schema_version":1,"phase":"20","completed_at":"2026-09-11T14:05:00+04:00","files_changed":["python/codeflow_ml/runtime.py","python/codeflow_ml/test_runtime.py"],"commands_run":["python -m unittest python.codeflow_ml.test_runtime python.codeflow_ml.test_workflows python.codeflow_ml.test_baselines -v","python scripts/no_llm_guard.py"],"tests":["8 combined tests passed, covering runtime schema validation, deterministic sampling, UPSM correlation, observed call/event/state evidence, privacy redaction, malformed traces, and static workflow regression"],"test_outcomes":[{"name":"trace ingestion and validation","status":"passed"},{"name":"runtime correlation and privacy","status":"passed"},{"name":"malformed trace handling","status":"passed"}],"benchmark_outcomes":[{"name":"sampling determinism","status":"passed","details":"Blake2b-derived event sampling is deterministic and bounded by sample rate."}],"known_limitations":["Runtime evidence is optional and observed-only; it is never interpreted as exhaustive behavior."],"no_llm_compliance":true,"schema_changes":["Added TraceEvent schema and optional runtime intake/correlation/redaction APIs."],"next_phase_dependencies":["persistence/versioning and API contracts"]}
