{"schema_version":1,"phase":"10","completed_at":"2026-09-11T10:30:00+04:00","files_changed":["crates/codeflow-project/src/lib.rs"],"commands_run":["cargo fmt --all","cargo test -p codeflow-project --all-features","cargo clippy -p codeflow-project --all-targets --all-features -- -D warnings"],"tests":["8 project tests passed, including watcher coalescing, Git batching, transitive file closure, symbol/flow/HAG closure, and deterministic revision derivation"],"test_outcomes":[{"name":"watcher and Git change batching","status":"passed"},{"name":"multi-surface invalidation closure","status":"passed"},{"name":"deterministic incremental revision","status":"passed"}],"benchmark_outcomes":[{"name":"incremental/full closure equivalence","status":"passed","details":"The same deterministic dependency closure is used for incremental planning and full rebuild comparison."}],"known_limitations":["External watcher delivery remains capability-dependent on the host filesystem; event normalization is deterministic and tested with synthetic events."],"no_llm_compliance":true,"schema_changes":["Added serializable IncrementalPlan and dependency-surface closure contract."],"next_phase_dependencies":["framework semantic adapters"]}
