{"schema_version":1,"phase":"23","completed_at":"2026-09-11T16:10:00+04:00","files_changed":["python/codeflow_ml/graph_data.py","python/codeflow_ml/test_graph_data.py"],"commands_run":["python -m unittest python.codeflow_ml.test_graph_data python.codeflow_ml.test_experiments python.codeflow_ml.test_runtime python.codeflow_ml.test_workflows python.codeflow_ml.test_baselines -v","python scripts/no_llm_guard.py"],"tests":["11 tests passed, including heterogeneous node/edge mapping, typed feature construction, deterministic lexical hashing, scalar normalization, invalid-edge leakage filtering, and all prior experiment/runtime/workflow regressions"],"test_outcomes":[{"name":"heterogeneous graph mapping","status":"passed"},{"name":"typed features and edges","status":"passed"},{"name":"round-trip and leakage control","status":"passed"}],"benchmark_outcomes":[{"name":"neighbor-compatible stable ordering","status":"passed","details":"Nodes and edges are sorted by canonical IDs and invalid endpoints are excluded."}],"known_limitations":["Graph tensors use dependency-free tuples rather than importing PyTorch Geometric; the shape and ordering contract is compatible with a later adapter."],"no_llm_compliance":true,"schema_changes":["Added HeteroGraphData mapping, lexical hashing, scalar normalization, and graph builder."],"next_phase_dependencies":["self-supervised graph representation and comparative gate"]}
