{
  "schema_version": 1,
  "phase": "00",
  "completed_at": "2026-09-10T17:04:25+04:00",
  "files_changed": ["AGENTS.md", "CLAUDE.md", "Execution/Execution 01.state.json", "schemas/phase-evidence.schema.json", "scripts/commands.json", "scripts/harness.py", "scripts/no_llm_guard.py", "scripts/tests/test_harness.py"],
  "commands_run": ["python -m unittest discover -s scripts/tests -v", "python scripts/harness.py self-audit", "python scripts/no_llm_guard.py", "git diff --check"],
  "tests": ["scripts/tests/test_harness.py: 3 passed", "harness self-audit: passed", "no-LLM guard: passed"],
  "test_outcomes": [{"name": "harness unit suite", "status": "passed", "count": 3}, {"name": "self audit", "status": "passed"}, {"name": "no LLM guard", "status": "passed"}, {"name": "git diff check", "status": "not_applicable", "reason": "repository has no .git directory"}],
  "benchmark_outcomes": [],
  "known_limitations": ["Rust and Cargo are unavailable in the current environment; Phase 01 will attempt supported toolchain bootstrap or record a capability-scoped blocker."],
  "no_llm_compliance": true,
  "schema_changes": ["Added phase-evidence schema version 1."],
  "next_phase_dependencies": ["Rust toolchain availability", "Cargo workspace initialization"]
}
